{"$schema":"https://json-schema.org/draft/2020-12/schema","$id":"https://ai-employee-os.local/contracts/artifact-ref.schema.json","title":"ArtifactRef","type":"object","required":["schema_version","artifact_id","kind","uri","media_type","size_bytes","sha256","sensitivity","verification_status"],"properties":{"schema_version":{"const":"1.0.0"},"artifact_id":{"type":"string"},"kind":{"type":"string"},"uri":{"type":"string"},"media_type":{"type":"string"},"size_bytes":{"type":"integer","minimum":0},"sha256":{"type":"string","pattern":"^[0-9a-f]{64}$"},"created_by_action_id":{"type":["string","null"]},"sensitivity":{"enum":["public","internal","sensitive"]},"verification_status":{"enum":["pending","verified","failed"]}},"additionalProperties":false}
