{"schema_version":"1.0.0","artifact_id":"artifact_1","kind":"markdown","uri":"deliverables/note.md","media_type":"text/markdown","size_bytes":2,"sha256":"aaaaaaaaaaaaaaaaaaaaaaaaaaaaaaaaaaaaaaaaaaaaaaaaaaaaaaaaaaaaaaaa","created_by_action_id":null,"sensitivity":"internal","verification_status":"verified"}
